<?xml version="1.0" encoding="UTF-8"?>
<!DOCTYPE calendar SYSTEM "calendar.dtd">

<calendar>
  <dayEvent>
    <name>First event</name>
    <startDate>2010-mar-26 10:27:20</startDate>
    <endDate>2010-mar-26 11:27:20</endDate>
    <category>Home</category>
    <priority>LOW</priority>
  </dayEvent>
  <dayEvent>
    <name>Second Event</name>
    <startDate>2010-mar-27 10:27:20</startDate>
    <endDate>2010-mar-27 11:27:20</endDate>
    <category>Home</category>
    <priority>LOW</priority>
  </dayEvent>
</calendar>

