<?xml version="1.0" encoding="UTF-8"?>
<!DOCTYPE calendar SYSTEM "calendar.dtd">

<calendar>
  <dayEvent>
    <name>test2</name>
    <startDate>2010-05-13 20:29</startDate>
    <endDate>2010-05-13 21:29</endDate>
    <category>catEdit</category>
    <priority>MEDIUM</priority>
  </dayEvent>
  <dayEvent>
    <name>test</name>
    <startDate>2010-05-12 20:29</startDate>
    <endDate>2010-05-12 21:29</endDate>
    <category>cat</category>
    <priority>MEDIUM</priority>
  </dayEvent>
</calendar>

